,ID,StringText
0,Section1Sent1,"Δεύτερος μετὰ Σηιανὸν Φλάκκος Ἀουίλλιος διαδέχεται τὴν 
κατὰ τῶν Ἰουδαίων ἐπιβουλήν,"
1,Section1Sent2,"σύμπαν μὲν ἀδικῆσαι τὸ ἔθνος ὥσπερ 
ἐκεῖνος ἄντικρυς οὐ δυνηθείς"
2,Section1Sent3,—
3,Section1Sent4,"ἐλάττους γὰρ εἶχε τὰς εἰς τοῦτ’ ἀφορμάς
—,"
4,Section1Sent5,"ἐφ’ ὅσους δ’ ἔφθανεν, ἀθρόους ἀνηκέστοις περιέπειρε κακοῖς. οὐ μὴν
ἀλλὰ καὶ μέρει δόξας ἐπιτίθεσθαι τὴν ἐπιβουλὴν ἐξέτεινεν ἐπιὼν τοὺς
πανταχοῦ πάντας διὰ τέχνης τὸ πλέον ἢ δυνάμεως·"
5,Section1Sent6,"οἷς γὰρ ἰσχὺς οὐ
πρόσεστι τῶν τὰς φύσεις τυραννικῶν, πανουργίαις τὰς ἐπιβουλὰς κατορθοῦσιν."
6,Section2Sent1,"ὁ Φλάκκος οὖν οὗτος ἐν τοῖς ἑταίροις κριθεὶς παρὰ Τιβερίῳ
Καίσαρι μετὰ τὴν Ἱβήρου τελευτήν,"
7,Section2Sent2,"ὃς ἐπετέτραπτο Αἴγυπτον, καθίσταται
τῆς Ἀλεξανδρείας καὶ τῆς χώρας ἐπίτροπος, ἄνθρωπος ἐν ἀρχῇ μυρία καλοκαγαθίας
ὅσα τῷ δοκεῖν ἐξενεγκὼν δείγματα·"
8,Section2Sent3,"πυκνός τε γὰρ ἦν καὶ
συνεχὴς καὶ ὀξὺς νοῆσαι καὶ τὰ βουλευθέντα πρᾶξαι καὶ προχειρότατος 
 εἰπεῖν καὶ πρὸ τοῦ λεγομένου τὸ ἡσυχαζόμενον αἰσθέσθαι."
9,Section3Sent1,"παντάπασιν
οὖν ὀλίγῳ χρόνῳ τῶν κατὰ τὴν Αἴγυπτον πραγματειῶν ἐθὰς γίνεται·"
10,Section3Sent2,"πολύτροποι δ’ εἰσὶ καὶ ποικίλαι, μόλις τοῖς ἐκ πρώτης ἡλικίας τὸ ἔργον
ἐπιτήδευμα πεποιημένοις γνωριζόμεναι. περιττὸς ὄχλος ἦσαν οἱ γραμματεῖς"
11,Section3Sent3,","
12,Section3Sent4,"ἤδη πρὸς πάντα μικρὰ καὶ μεγάλα φθάνοντος αὐτοῦ ταῖς ἐμπειρίαις, ὡς
μὴ μόνον ὑπερβαλεῖν ἀλλὰ χάριν ἀκριβείας ἀντὶ γνωρίμου διδάσκαλον
γεγενῆσθαι τῶν τέως ὑφηγητῶν."
13,Section4Sent1,"καὶ ὅσα μὲν περὶ λογισμοὺς καὶ τὴν τῶν προσοδευομένων κατώρθου διοίκησιν, εἰ καὶ μεγάλα καὶ ἀναγκαῖα ἦν,
 ἀλλ’ οὐδέν γε δεῖγμα   ψυχῆς ὑπέφαινεν ἡγεμονικῆς,"
14,Section4Sent2,"ἃ δὲ λαμπροτέραν
 καὶ βασιλικὴν ἐδήλου φύσιν, μετὰ πλείονος παρρησίας ἐπεδείκνυτο· οἷον
σεμνότερον ἦγεν αὑτόν"
15,Section4Sent3,"— ἄρχοντι δὲ λυσιτελέστατον ὁ τῦφος —, ἐδίκαζε
τὰ μεγάλα μετὰ τῶν ἐν τέλει, τοὺς ὑπεραύχους καθῄρει, μιγάδων καὶ
συγκλύδων ἀνθρώπων ὄχλον ἐκώλυεν ἐπισυνίστασθαι· τάς τε ἑταιρείας
 καὶ συνόδους, αἳ ἀεὶ ἐπὶ προφάσει θυσιῶν εἱστιῶντο τοῖς πράγμασιν
ἐμπαροινοῦσαι, διέλυε τοῖς ἀφηνιάζουσιν ἐμβριθῶς καὶ εὐτόνως προσφερόμενος."
16,Section5Sent1,"εἶτ’ ἐπειδὴ τὴν πόλιν καὶ τὴν χώραν ἀνέπλησεν εὐνομίας, ἐν μέρει πάλιν ταῖς στρατιωτικαῖς δυνάμεσιν ἐφήδρευεν ἐκτάττων, συγκροτῶν,
γυμνάζων πεζούς,"
17,Section5Sent2,"ἱππεῖς, τοὺς τῆς κούφης ὁπλίσεως, τοὺς ἡγεμόνας, ἵνα
 μὴ τὰς μισθοφορὰς τῶν στρατιωτῶν ἀφαιρούμενοι πρὸς λῃστείας"
18,Section5Sent3,"καὶ
ἁρπαγὰς αὐτοὺς ἀλείφωσι, πάλιν τῶν στρατιωτῶν ἕκαστον, ἵνα μηδὲν
ἔξω τῶν κατὰ τὴν στρατείαν περιεργάζηται μεμνημένος, ὅτι τέτακται
καὶ τὴν εἰρήνην διαφυλάττειν."
19,Section6Sent1,Ἴσως δ’ ἄν τις εἴποι·
20,Section6Sent2,"„σὺ δ’, ὦ οὗτος, ἐγνωκὼς ἀνθρώπου  κατηγορεῖν ἔγκλημα μὲν οὐδὲν διεξῆλθες, μακροὺς δ’ ἐπαίνους συνείρεις·
μὴ ἄρα παραπαίεις καὶ μέμηνας;“ — οὐ μέμηνα,"
21,Section6Sent3,"ὦ οὗτος, οὐδ’ ἠλίθιός
τίς εἰμι, ὡς μὴ δύνασθαι πράγματος ἀκολουθίαν ἰδεῖν."
22,Section7Sent1,"ἐπαινῶ τὸν Φλάκκον, οὐκ ἐπειδὴ προσῆκεν ἐχθρὸν ἐγκωμιάζειν, ἀλλ’ ἵν’ αὐτοῦ τὴν
μοχθηρίαν ἀριδηλοτέραν παραστήσω·"
23,Section7Sent2,"τῷ μὲν γὰρ ἀγνοίᾳ τοῦ κρείττονος
 διαμαρτάνοντι συγγνώμη δίδοται,"
24,Section7Sent3,"ὁ δ’ ἐξ ἐπιστήμης ἀδικῶν ἀπολογίαν
οὐκ ἔχει προεαλωκὼς ἐν τῷ τοῦ συνειδότος δικαστηρίῳ."
25,Section8Sent1,ἑξαετίαν
26,Section8Sent2,"γὰρ τὴν ἐπικράτειαν λαβὼν πέντε μὲν ἔτη τὰ πρῶτα, ζῶντος Τιβερίου
Καίσαρος, τήν τε εἰρήνην διεφύλαξε καὶ οὕτως εὐτόνως καὶ ἐρρωμένως
 ἀφηγήσατο, ὡς τοὺς πρὸ αὐτοῦ πάντας ὑπερβαλεῖν."
27,Section9Sent1,"τῷ δ’ ὑστάτῳ,
Τιβερίου μὲν τελευτήσαντος, Γαΐου δ’ ἀποδειχθέντος αὐτοκράτορος, ὑφιέναι
καὶ χαλᾶν ἤρξατο τὰ πάντα εἴτε διὰ τὸ ἐπὶ Τιβερίῳ βαρύτατον πένθος"
28,Section9Sent2,"— δῆλος γὰρ ἦν ὡς ἐπ’ οἰκειοτάτῳ περιπαθῶν ἔκ τε τῆς συνεχοῦς
κατηφείας καὶ τῆς τῶν δακρύων φορᾶς, ἃ καθάπερ ἀπὸ πηγῆς ἀπαύστως
ἐξεχεῖτο — εἴτε καὶ κακόνους ὢν τῷ διαδόχῳ διὰ τὸ τὴν τῶν γνησίων
πρὸ τῆς τῶν θετῶν τεθεραπευκέναι μερίδα εἴτε καὶ τῶν συνεπιθεμένων
τῇ Γαΐου μητρί, καθ’ ὃν χρόνον εἶχε τὰς αἰτίας ἐφ’ αἷς ἀνῃρέθη, γεγονὼς 
 καὶ διὰ φόβον ἁλώσεως ἐπιλελησμένος."
29,Section10Sent1,"καὶ μέχρι μέν τινος ἔτ’ ἀντεῖχε
μὴ κατὰ τὸ παντελὲς μεθιέμενος τὴν τῶν πραγμάτων ἀντίληψιν."
30,Section10Sent2,"ὡς
δ’ ἤκουσε τὸν Τιβερίου μὲν υἱωνὸν κοινωνὸν δὲ τῆς ἀρχῆς ἀναιρεθέντα
  Γαΐου κελεύσαντος, ἀλέκτῳ πληγεὶς συμφορᾷ καταβαλὼν ἑαυτὸν ἀχανὴς
ἔκειτο, τῆς διανοίας πολὺ πρότερον ἀπειρηκυίας καὶ παρειμένης αὐτῷ."
31,Section11Sent1,"ζῶντος μὲν γὰρ τοῦ μειρακίου τὰ ζώπυρα τῆς ἰδίας σωτηρίας οὐκ ἀπεγίνωσκεν,"
32,Section11Sent2,"ἀποθανόντος δὲ συντεθνάναι καὶ τὰς οἰκείας ἐλπίδας ἔδοξεν, εἰ
καὶ μικρά τις ἀπελείπετο αὔρα βοηθείας, ἡ πρὸς Μάκρωνα φιλία τὰ
σύμπαντα παρὰ Γαΐῳ κατ’ ἀρχὰς δυνηθέντα καὶ πλείστην μοῖραν ὡς
λόγος εἰσενεγκάμενον αὐτῷ πρὸς τὸ τυχεῖν τῆς ἡγεμονίας καὶ ἔτι μᾶλλον 
 πρὸς τὸ σωθῆναι"
33,Section11Sent3,","
34,Section12Sent1,"πολλάκις μὲν ἐκποδὼν ποιήσασθαι τὸν Γάιον διανοηθέντος
Τιβερίου ὡς κακοήθη καὶ οὐ πεφυκότα πρὸς ἀρχήν, καὶ ἅμα
διὰ τὸν ἐπὶ τῷ υἱωνῷ φόβον — ἐδεδίει γάρ, μὴ παρανάλωμα γένηται
τελευτήσαντος αὐτοῦ"
35,Section12Sent2,"—,"
36,Section12Sent3,"πολλάκις δὲ τοῦ Μάκρωνος τὰς ὑπονοίας ὑπεξαιρουμένου
καὶ τὸν Γάιον ἐπαινοῦντος ὡς ἁπλοῦν καὶ ἀπόνηρον καὶ κοινωνικὸν 
καὶ τοῦ ἀνεψιοῦ μάλιστα ἡττημένον, ὡς ἢ μόνῳ ἂν ἐθελῆσαι παραχωρῆσαι
 τὴν ἡγεμονίαν ἢ πάντως τὰ πρωτεῖα."
37,Section13Sent1,"ὑφ’ ὧν ἀπατηθεὶς ἔλαθεν ἄσπονδον
ἐχθρὸν ἑαυτῷ καὶ υἱωνῷ καὶ γένει καὶ παρακλήτῳ Μάκρωνι καὶ πᾶσιν
 ἀνθρώποις καταλιπών."
38,Section14Sent1,"ἐπειδὴ γὰρ ὁ Μάκρων ὁρῶν αὐτὸν ἐκδιαιτώμενον
καὶ ἀχαλίνοις ταῖς ὁρμαῖς, ἐφ’ ἃ ἂν τύχῃ καὶ ὡς ἂν τύχῃ, χρώμενον"
39,Section14Sent2,ἐνουθέτει καὶ παρηγόρει νομίζων ἐκεῖνον εἶναι Γάιον
40,Section14Sent3,"τόν, ἡνίκ’ ἔτ’ ἔζη
Τιβέριος, ἐπιεικῆ"
41,Section14Sent4,"καὶ πειθαρχικόν, ὁ κακοδαίμων εὐνοίας περιττῆς ἔδωκε
τὰς ἀνωτάτω δίκας πανοίκιος αὐτῇ γυναικὶ καὶ τέκνοις συναναιρεθεὶς ὡς
περιττὸν ἄχθος καὶ παρενόχλημα."
42,Section15Sent1,καὶ γὰρ ὁπότε πόρρωθεν αὐτὸν ἀφικνούμενον
43,Section15Sent2,"ἴδοι, τοιαῦτα πρὸς τοὺς συνόντας διεξῄει· „μὴ μειδιῶμεν,
κατηφῶμεν· ὁ νουθετητὴς παραγίνεται, ὁ αὐθέκαστος, ὁ ἀνδρὸς τελείου
καὶ αὐτοκράτορος ἀρξάμενος νῦν εἶναι παιδαγωγός, ὅτε καὶ τοὺς ἐκ πρώτης
ἡλικίας ὁ καιρὸς ἀπήλασε καὶ διέζευξεν.“"
44,Section16Sent1,"Ἐπεὶ δ’ οὖν καὶ τοῦτον ἔγνω προσανῃρημένον ὁ Φλάκκος,  τὴν λοιπὴν ἐλπίδα κατὰ τὸ παντελὲς ἀπεγνώκει καὶ οὐκέθ’ ὁμοίως
ἀντιλαμβάνεσθαι τῶν πραγμάτων οἷός τε ἦν ἐξασθενῶν καὶ διαρρέων
τὴν γνώμην."
45,Section17Sent1,"ὅταν δ’ ὁ ἄρχων ἀπογνῷ τὸ δύνασθαι κρατεῖν, ἀνάγκη τοὺς ὑπηκόους εὐθὺς ἀφηνιάζειν καὶ μάλιστα τοὺς ἐκ μικρῶν καὶ τῶν
τυχόντων πεφυκότας ἀνερεθίζεσθαι· ἐν οἷς τὸ Αἰγυπτιακὸν τὰ πρωτεῖα
 φέρεται διὰ βραχυτάτου σπινθῆρος εἰωθὸς ἐκφυσᾶν στάσεις μεγάλας."
46,Section18Sent1,"ἐν ἀμηχάνοις δὲ καὶ ἀπόροις γεγονὼς ἐσφάδᾳζε καὶ τὰ πρὸ μικροῦ πάντα  ἤλλαξεν ἅμα τῇ τοῦ λογισμοῦ   πρὸς τὸ χεῖρον μεταβολῇ ποιησάμενος τὴν
ἀρχὴν ἀπὸ τῶν συνηθεστάτων·"
47,Section18Sent2,"τοὺς μὲν γὰρ εὔνους καὶ μάλιστα φίλους
ὑφωρᾶτο καὶ διωθεῖτο,"
48,Section18Sent3,"τοῖς δ’ ἐξ ἀρχῆς ἀνομολογηθεῖσιν ἐχθροῖς ἐσπένδετο
 καὶ συμβούλοις περὶ πάντων ἐχρῆτο."
49,Section19Sent1,"οἱ δ’ — ἐγκότως γὰρ εἶχον — τὸ κατηλλάχθαι δοκεῖν λόγῳ μόνον ἐπιμορφάσαντες,"
50,Section19Sent2,"ἔργοις δὲ κατὰ
διάνοιαν ἀσύμβατα μνησικακοῦντες καὶ ὥσπερ ἐν θεάτρῳ καθυποκρινόμενοι
γνησίαν φιλίαν ὅλον αὐτὸν συναρπάζουσι· καὶ γίνεται"
51,Section19Sent3,ὁ μὲν ἄρχων
52,Section19Sent4,"ὑπήκοος, οἱ δ’ ὑπήκοοι ἡγεμόνες, εἰσηγούμενοι μὲν ἀλυσιτελεστάτας γνώμας,
 εὐθὺς δὲ ταύτας ἐπισφραγιζόμενοι."
53,Section20Sent1,"βεβαιωταὶ γὰρ ὧν ἐβουλεύσαντο
πάντων ἐγίνοντο κωφὸν ὡς ἐπὶ σκηνῆς προσωπεῖον ἕνεκα προσχήματος
αὐτὸ μόνον παραλαμβάνοντες ἐπιγεγραμμένον ὄνομα ἀρχῆς, Διονύσιοι δημοκόποι,
Λάμπωνες γραμματοκύφωνες, Ἰσίδωροι στασιάρχαι, φιλοπράγμονες, 
 κακῶν εὑρεταί, ταραξιπόλιδες·"
54,Section20Sent2,τοῦτο γὰρ κεκράτηκέ πως τοὔνομα.
55,Section21Sent1,"συνταξάμενοι πάντες οὗτοι βούλευμα βουλεύουσι κατὰ τῶν Ἰουδαίων ἀργαλεώτατον
 καὶ τῷ Φλάκκῳ προσελθόντες ἰδίᾳ φασίν·"
56,Section22Sent1,"""ἔρρει μέν σοι τὰ
ἀπὸ Τιβερίου Νέρωνος τοῦ παιδός,"
57,Section22Sent2,"ἔρρει δὲ καὶ ἡ μετ’ ἐκεῖνον ἐλπίς,
ὁ ἑταῖρός σου Μάκρων,"
58,Section22Sent3,αἴσια δ’ οὐκ ἔστι σοι τὰ ἀπὸ τοῦ κρατοῦντος·
59,Section22Sent4,"δεῖ δὴ παράκλητον ἡμᾶς εὑρεῖν δυνατώτατον, ὑφ’ οὗ Γάιος ἐξευμενισθήσεται."
60,Section23Sent1,"ὁ δὲ παράκλητος ἡ πόλις Ἀλεξανδρέων ἐστίν, ἣν τετίμηκε μὲν
ἐξ ἀρχῆς ἅπας ὁ Σεβαστὸς οἶκος, διαφερόντως δ’ ὁ νῦν ἡμῶν δεσπότης."
61,Section23Sent2,παρακλητεύσει δὲ τυχοῦσά τινος παρὰ σοῦ δωρεᾶς·
62,Section23Sent3,"μεῖζον δ’ ἀγαθὸν
 οὐδὲν αὐτῇ παρέξεις ἢ τοὺς Ἰουδαίους ἐκδοὺς καὶ προέμενος.“"
63,Section24Sent1,"ἐπὶ 
τούτοις ὀφείλων ἀπώσασθαι καὶ δυσχερᾶναι τοὺς λέγοντας ὡς νεωτεροποιοὺς
καὶ κοινοὺς πολεμίους συνεπιγράφεται τοῖς λεχθεῖσι."
64,Section24Sent2,"καὶ τὸ μὲν
πρῶτον ἀδηλοτέρας ἐποιεῖτο τὰς ἐπιβουλὰς μήτ’ ἴσον παρέχων καὶ κοινὸν
ἀκροατὴν ἑαυτὸν τοῖς τὰς ἀμφισβητήσεις ἔχουσιν, ἀλλὰ πρὸς θάτερον
ἀποκλίνων μέρος, μήτ’ ἐν τοῖς ἄλλοις ἰσηγορίαν διδούς, ἀλλὰ καὶ ὁπότε 
προσίοι τις τῶν Ἰουδαίων, ἀποστρεφόμενος καὶ τὸ δυσέντευκτον ἐπιτηδεύων
ἐπὶ μόνων τούτων·"
65,Section24Sent3,αὖθις δὲ καὶ ἐκ τοῦ φανεροῦ τὴν δυσμένειαν ἐπεδείξατο.
66,Section25Sent1,"Προσεπέρρωσε δ’ αὐτοῦ τὴν ἐκ μαθήσεως τὸ πλέον ἢ φύσεως
ἐπιτετηδευμένην ἀπόνοιαν καὶ συντυχία τις τοιαύτη. Γάιος Καῖσαρ
Ἀγρίππᾳ τῷ Ἡρῴδου βασιλέως υἱωνῷ δίδωσι βασιλείαν   τῆς παππῴας
λήξεως τρίτην μοῖραν, ἣν Φίλιππος τετράρχης θεῖος ὢν αὐτῷ πρὸς 
 πατρὸς ἐκαρποῦτο."
67,Section26Sent1,"μέλλοντι δ’ ἀπαίρειν συνεβούλευσεν ὁ Γάιος τὸν μὲν
ἀπὸ Βρεντεσίου μέχρι Συρίας πλοῦν μακρὸν ὄντα καὶ καματηρὸν"
68,Section26Sent2,"παραιτήσασθαι,"
69,Section26Sent3,"χρῆσθαι δ’ ἐπιτόμῳ τοὺς ἐτησίας ἀναμείναντι τῷ διὰ τῆς
Ἀλεξανδρείας·"
70,Section26Sent4,"τάς τε γὰρ ἐκεῖθεν ὁλκάδας ταχυναυτεῖν ἔφασκε καὶ
ἐμπειροτάτους εἶναι κυβερνήτας, οἳ καθάπερ ἀθλητὰς ἵππους ἡνιοχοῦσιν
ἀπλανῆ παρέχοντες τὸν ἐπ’ εὐθείας δρόμον."
71,Section26Sent5,"ὁ δὲ πειθαρχεῖ ὡς δεσπότῃ
 τε ἅμα καὶ τὰ δοκοῦντα συμφέρειν παραγγέλλοντι."
72,Section27Sent1,"καταβὰς δ’ εἰς Δικαιάρχειαν καὶ ναῦς ὑφόρμους Ἀλεξανδρίδας ἰδὼν εὐτρεπεῖς πρὸς ἀναγωγήν,
ἐπιβὰς μετὰ τῶν ἰδίων, εὐπλοίᾳ χρησάμενος, ὀλίγαις ὕστερον
ἡμέραις ἀνεπιφάτως καὶ ἀφωράτως κατάγεται, κελεύσας τοῖς κυβερνήταις"
73,Section27Sent2,"— περὶ γὰρ δείλην ὥραν ὁ Φάρος ἀναφαίνεται — τὰ μὲν ἱστία συνάγειν,
 ἔξω δὲ περὶ αὐτὸν μὴ μακρὰν ἀφισταμένους θαλαττεύειν ἄχρι τοῦ βαθεῖαν ἑσπέραν ἐπιγενέσθαι καὶ νυκτὸς τοῖς λιμέσι προσσχεῖν, ἵν’ ἀποβὰς
ἤδη τετραμμένων ἁπάντων πρὸς ὕπνον, μηδενὸς ὁρῶντος, ἀφίκηται πρὸς
τὸν ξενοδόχον."
74,Section28Sent1,"ὁ μὲν δὴ μετὰ τοσαύτης αἰδοῦς ἐπεδήμησε βουλόμενος, εἴ πως οἷόν τε ἦν, ἅπαντας τοὺς ἐν τῇ πόλει λαθὼν ὑπεξελθεῖν·"
75,Section28Sent2,"οὐ
 γὰρ κατὰ θέαν ἀφῖκτο τῆς Ἀλεξανδρείας ἐπιδεδημηκὼς αὐτῇ πρότερον,
ἡνίκα τὸν ἐπὶ Ῥώμης πλοῦν ἐστέλλετο πρὸς Τιβέριον, ἀλλ’ ὁδῷ χρησόμενος
ἐπιτόμῳ τῆς οἴκαδε ἀφίξεως."
76,Section29Sent1,"οἱ δ’ ὑπὸ φθόνου ῥηγνύμενοι — βάσκανον γὰρ φύσει τὸ Αἰγυπτιακόν — καὶ τὰς ἑτέρων εὐτυχίας
ἰδίας ὑπελάμβανον εἶναι κακοπραγίας καὶ ἅμα διὰ τὴν παλαιὰν καὶ τρόπον
 τινὰ φύσει γεγενημένην πρὸς Ἰουδαίους ἀπέχθειαν ἤσχαλλον ἐπὶ τῷ
γεγενῆσθαί τινα βασιλέα Ἰουδαῖον οὐχ ἧττον, ἢ εἰ αὐτός τις ἕκαστος
βασιλείαν προγονικὴν ἀφῄρητο."
77,Section30Sent1,"καὶ τὸν ἄθλιον Φλάκκον πάλιν οἱ συνόντες ἀνηρέθιζον εἰς τὸν αὐτὸν ἐνάγοντες καὶ προκαλούμενοι
φθόνον, „σὴ κατάλυσίς ἐστι“ φάσκοντες „ἡ ἐπιδημία τούτου· μείζονα
 τιμῆς καὶ εὐδοξίας ὄγκον ἢ σὺ περιβέβληται· πάντας εἰς ἑαυτὸν ἐπιστρέφει
τὴν δορυφόρον τῶν σωματοφυλάκων στρατιὰν ὁρῶντας ἐπαργύροις"
78,Section30Sent2,καὶ ἐπιχρύσοις ὅπλοις διακεκοσμημένην.
79,Section31Sent1,"ἔδει γὰρ ἥκειν εἰς ἐπικράτειαν
ἑτέρου δυνάμενον πλῷ χρησάμενον εἰς τὴν οἰκείαν ἀσφαλῶς παραπεμφθῆναι;"
80,Section31Sent2,"καὶ γὰρ εἰ Γάιος ἐπέτρεπε,"
81,Section31Sent3,"μᾶλλον δ’ ἠνάγκαζεν, ἐχρῆν ἐκλιπαρήσαντα
παραιτήσασθαι τὴν ἐνθάδε ἄφιξιν, ἵνα μὴ παρευημερηθεὶς ὁ τῆς
 χώρας ἡγεμὼν ἀδοξῇ.“"
82,Section32Sent1,ταῦτα ἀκούων ἔτι μᾶλλον ἢ πρότερον ᾤδει
83,Section32Sent2,"καὶ 
ἐν μὲν τῷ φανερῷ τὸν ἑταῖρον καὶ φίλον καθυπεκρίνετο διὰ τὸν ἐκ τοῦ
πέμψαντος φόβον,"
84,Section32Sent3,"ἰδίᾳ δὲ ἐζηλοτύπει καὶ ἐξελάλει τὸ μῖσος καὶ πλαγίως 
 αὐτὸν  ὕβριζεν, ἐπειδήπερ ἄντικρυς οὐκ ἐθάρρει."
85,Section33Sent1,"τῷ γὰρ ἀργοῦντι καὶ
σχολάζοντι τῆς πόλεως ὄχλῳ"
86,Section33Sent2,"— πλῆθος δ’ ἐστὶν ἐπιτετηδευκὸς γλωσσαλγίαν
καὶ ἐνευκαιροῦν διαβολαῖς καὶ βλασφημίαις — ἐπιτρέπει κακηγορεῖν 
τὸν βασιλέα εἴτε ἀρξάμενος δι’ ἑαυτοῦ τῶν λοιδοριῶν εἴτε προτρεψάμενος
καὶ ἐναγαγὼν αὐτὸς διὰ τῶν ὑπηρετεῖν τὰ τοιαῦτα εἰωθότων."
87,Section34Sent1,"οἱ δ’ ἀφορμῆς λαβόμενοι διημέρευον ἐν τῷ γυμνασίῳ χλευάζοντες τὸν
βασιλέα καὶ σκώμματα συνείροντες· πῇ δὲ καὶ ποιηταῖς μίμων καὶ γελοίων
διδασκάλοις χρώμενοι τὴν ἐν τοῖς αἰσχροῖς εὐφυΐαν ἐπεδείκνυντο, βραδεῖς 
μὲν ὄντες τὰ καλὰ παιδεύεσθαι, τὰ δ’ ἐναντία μανθάνειν ὀξύτατοι καὶ
 προχειρότατοι."
88,Section35Sent1,"διὰ τί γὰρ οὐκ ἠγανάκτησεν, οὐκ ἀπήγαγεν, οὐκ ἐπέπληξε
τῆς αὐθάδους βλασφημίας;"
89,Section35Sent2,"εἰ δὲ μὴ βασιλεὺς ἦν, ἀλλά τις τῶν ἐκ τῆς
Καίσαρος οἰκίας, οὐκ ὤφειλε προνομίαν τινὰ καὶ τιμὴν ἔχειν; ἀλλὰ
ταῦτ’ εἰσὶ πίστεις ἐναργεῖς τοῦ συναίτιον γεγενῆσθαι τῶν βλασφημιῶν 
Φλάκκον·"
90,Section35Sent3,"ὁ γὰρ ἐπιπλήττειν ἢ τὸ πανύστατον ἐπέχειν ἂν δυνηθεὶς εἰ
μὴ κεκώλυκε, δῆλος ἦν ἐφιεὶς καὶ ἐπιτρέπων αὐτός."
91,Section35Sent4,"πρὸς ὅ τι δ’ ἂν
ὄχλος ἀσύντακτος ἀφορμὴν λάβῃ τῶν ἁμαρτημάτων, οὐχ ἵσταται,"
92,Section35Sent5,"μέτεισι
δ’ ἀφ’ ἑτέρων εἰς ἕτερα προσεπεξεργαζόμενος ἀεί τι νεώτερον."
93,Section36Sent1,Ἦν τις μεμηνὼς ὄνομα Καραβᾶς οὐ τὴν ἀγρίαν καὶ θηριώδη μανίαν
94,Section36Sent2,"— ἄσκηπτος γὰρ αὕτη γε καὶ τοῖς ἔχουσι καὶ τοῖς πλησιάζουσιν —,
ἀλλὰ τὴν ἀνειμένην καὶ μαλακωτέραν. οὗτος διημέρευε καὶ διενυκτέρευε
γυμνὸς ἐν ταῖς ὁδοῖς οὔτε θάλπος οὔτε κρυμὸν ἐκτρεπόμενος, ἄθυρμα
 νηπίων καὶ μειρακίων σχολαζόντων."
95,Section37Sent1,"συνελάσαντες τὸν ἄθλιον ἄχρι τοῦ γυμνασίου καὶ στήσαντες μετέωρον, ἵνα καθορῷτο πρὸς πάντων, βύβλον
μὲν εὐρύναντες ἀντὶ διαδήματος ἐπιτιθέασιν αὐτοῦ τῇ κεφαλῇ,"
96,Section37Sent2,"χαμαιστρώτῳ δὲ τὸ ἄλλο σῶμα περιβάλλουσιν ἀντὶ χλαμύδος,"
97,Section37Sent3,"ἀντὶ δὲ σκήπτρου
βραχύ τι παπύρου τμῆμα τῆς ἐγχωρίου καθ’ ὁδὸν ἐρριμμένον ἰδών
 τις ἀναδίδωσιν."
