,ID,StringText
0,Section1Sent1,"Τῶν μὲν οὖν διὰ τοῦ προφήτου Μωυσέως λογίων τρεῖς ἰδέας 
εἶναι συμβέβηκε, τὴν μὲν περὶ κοσμοποιίας, τὴν δὲ ἱστορικήν, τὴν δὲ
τρίτην νομοθετικήν."
1,Section1Sent2,"ἡ μὲν οὖν κοσμοποιία παγκάλως πᾶσα καὶ θεοπρεπῶς
μεμήνυται, λαβοῦσα τὴν ἀρχὴν ἀπὸ γενέσεως οὐρανοῦ καὶ λήξασα εἰς 
ἀνθρώπου κατασκευήν·"
2,Section1Sent3,"ὁ μὲν γὰρ ἀφθάρτων τελειότατος, ὁ δὲ θνητῶν."
3,Section1Sent4,"ἀθάνατα δὲ καὶ θνητὰ ἐν γενέσει συνυφαίνων ὁ ποιητὴς εἰργάσατο τὸν
κόσμον, τὰ μὲν [γενόμενα] ὡς ἡγεμονικά,"
4,Section1Sent5,"τὰ δ’ ὡς ὑπήκοα [καὶ]
 γενησόμενα."
5,Section2Sent1,"τὸ δὲ ἱστορικὸν μέρος ἀναγραφὴ βίων ἐστὶ σπουδαίων καὶ πονηρῶν
καὶ τὰ ὁρισθέντα ἑκατέροις ἐπιτίμια καὶ γέρα ἐν ἑκάσταις γενεαῖς."
6,Section2Sent2,"τοῦ δὲ 
νομοθετικοῦ τὸ μὲν καθολικωτέραν ὑπόθεσιν ἔχει,"
7,Section2Sent3,"τὸ δ’ ἕτερον τῶν κατὰ
μέρος νομίμων εἰσὶν ἐντολαί· κεφάλαια μὲν δέκα, ἅπερ λέγεται κεχρησμῳδῆσθαι
οὐ δι’ ἑρμηνέως ἀλλ’ ἐν τῷ ὑψώματι τοῦ ἀέρος σχηματιζόμενα
καὶ ἄρθρωσιν ἔχοντα λογικήν,"
8,Section2Sent4,"τὰ δ’ ἄλλα τὰ κατ’ εἶδος [μέρη]
 διὰ τοῦ   προφήτου θεσπισθέντα."
9,Section3Sent1,"περὶ ὧν ἁπάντων ὅσα καιρὸς ἐν ταῖς
προτέραις συντάξεσι διεξελθὼν καὶ προσέτι τῶν ἀρετῶν ἃς ἀπένειμεν"
10,Section3Sent2,"εἰρήνῃ τε καὶ πολέμῳ μέτειμι κατὰ τὸ ἀκόλουθον ἐπὶ τὰ προτεθέντα
καὶ τοῖς ἀγαθοῖς ἆθλα καὶ τοῖς πονηροῖς ἐπιτίμια."
11,Section4Sent1,"συνασκήσας γὰρ ὑφηγήσεσι καὶ προτροπαῖς μαλακωτέραις καὶ πάλιν ἐπανατάσεσι καὶ
νουθεσίαις ἐμβριθεστέραις τοὺς κατ’ αὐτὸν πολιτευομένους ἐκάλεσεν εἰς
 τὴν ὧν ἐπαιδεύθησαν ἐπίδειξιν·"
12,Section4Sent2,"οἱ δὲ παρελθόντες ὥσπερ εἰς ἱερὸν
ἀγῶνα γυμνὴν τὴν ἑαυτῶν προαίρεσιν ἀνέφηναν εἰς ἐναργέστατον ἔλεγχον
τῆς ἀληθείας."
13,Section5Sent1,"εἶτα οἱ μὲν ἀθληταὶ τῷ ὄντι ἀρετῆς ἀνευρίσκοντο μὴ ψεύσαντες τῆς ἐπ’ αὐτοῖς χρηστῆς ἐλπίδος τοὺς ἀλείπτας νόμους,"
14,Section5Sent2,"οἱ δὲ
ἄνανδροι καὶ ἀγεννεῖς ὑπὸ τῆς ἐμφύτου μαλακίας τὰς ψυχάς, πρὶν ἢ
 δυνατώτερόν τι ἀντιβιάσασθαι, προκαταπίπτοντες αἰσχύνη καὶ γέλως
θεατῶν ἐγίνοντο."
15,Section6Sent1,"δι’ ἣν αἰτίαν οἱ μὲν βραβείων καὶ κηρυγμάτων καὶ τῶν ἄλλων ὅσα νικῶσι δίδοται μετελάμβανον,"
16,Section6Sent2,"οἱ δὲ οὐκ ἀστεφάνωτοι
μόνον ἀπῄεσαν, ἀλλὰ καὶ ἧτταν ἐπονείδιστον ἐνδεξάμενοι τῶν ἐν τοῖς
γυμνικοῖς ἀγῶσιν ἀργαλεωτέραν·"
17,Section6Sent3,"ἐκεῖ μὲν γὰρ ἀθλητῶν σώματα κλίνεται
 ῥᾳδίως ὀρθοῦσθαι δυνάμενα,"
18,Section6Sent4,"ἐνταῦθα δὲ ὅλοι βίοι πίπτουσιν, οὓς ἅπαξ
ἀνατραπέντας μόλις ἔστιν ἀνεγεῖραι."
19,Section7Sent1,"Τῆς δὲ προνομίας καὶ τιμῆς καὶ τοὐναντίον κολάσεως τάξεις ἐναρμονίους ὑφηγεῖται, κατ’ ἄνδρας, κατ’ οἴκους, κατὰ πόλεις, κατὰ χώρας
καὶ ἔθνη, κατὰ κλίματα γῆς μεγάλα."
20,Section7Sent2,"πρότερον δ’ ἐρευνητέον τὰ
 ἐπὶ τιμαῖς, ἐπειδὴ καὶ λυσιτελέστερα καὶ ἡδίω πρὸς ἀκρόασιν, ἀρχὴν
λαμβάνοντας τὴν ἀφ’ ἑνὸς ἑκάστου τῶν ἐν μέρει."
21,Section8Sent1,"φασὶ τὸν παλαιὸν ἐκεῖνον Τριπτόλεμον Ἕλληνες ἀρθέντα μετέωρον ἐπὶ πτηνῶν δρακόντων
τὸν τοῦ σίτου καρπὸν εἰς ἅπασαν τὴν γῆν κατασπείρειν, ἀντὶ βαλανηφαγίας
ἵν’ ἔχῃ τὸ ἀνθρώπων γένος ἥμερον καὶ ὠφέλιμον καὶ ἡδίστην"
22,Section8Sent2,τροφήν.
23,Section8Sent3,"τοῦτο μὲν οὖν ὥσπερ πολλὰ καὶ ἄλλα τοῖς εἰωθόσι τερατεύεσθαι
μύθου πλάσμα ὂν ἀπολελείφθω σοφιστείαν πρὸ σοφίας καὶ γοητείαν πρὸ
 ἀληθείας ἐπιτετηδευκόσιν."
24,Section9Sent1,"ἐξ ἀρχῆς γὰρ ἅμα τῇ πρώτῃ γενέσει τῶν ὅλων
ὁ θεὸς προευτρεπίσατο τὰ ἐπιτήδεια πᾶσι τοῖς ζῴοις ἐκ γῆς ἀνείς, καὶ
μάλιστα τῷ γένει τῷ ἀνθρώπων, ᾧ τὴν ἐφ’ ἅπασι τοῖς γηγενέσιν ἡγεμονίαν 
ἐχαρίζετο."
25,Section9Sent2,"τῶν γὰρ θείων ἔργων οὐδὲν ὀψίγονον, ἀλλὰ καὶ ὅσα τέχναις καὶ
ἐπιμελείαις ὕστερον τελειοῦσθαι δοκεῖ, πάντως ἡμίεργα προϋπόκειται προμηθείᾳ
φύσεως, ὡς μὴ ἀπὸ σκοποῦ τὰς   μαθήσεις ἀναμνήσεις εἶναι
 λέγεσθαι."
26,Section10Sent1,ταῦτα μὲν οὖν ὑπερκείσθω·
27,Section10Sent2,"τὴν δ’ ἀναγκαιοτάτην σπορὰν
ἐπισκεπτέον, ἣν ὁ ποιητὴς ἐν ἀρετώσῃ χώρᾳ κατέσπειρε, λογικῇ ψυχῇ."
28,Section11Sent1,"ταύτης δ’ ὁ πρῶτος σπόρος ἐστὶν ἐλπίς, ἡ πηγὴ τῶν βίων."
29,Section11Sent2,"ἐλπίδι μὲν
γὰρ κέρδους ὁ χρηματιστὴς ἐπαποδύεται πολυτρόποις ἰδέαις πορισμῶν,"
30,Section11Sent3,"ἐλπίδι δ’ ὁ ναύκληρος εὐπλοίας περαιοῦται τὰ μακρὰ πελάγη· ἐλπίδι
δόξης καὶ ὁ φιλότιμος αἱρεῖται πολιτείαν καὶ κοινῶν πραγμάτων ἐπιμέλειαν·
δι’ ἐλπίδα βραβείων καὶ στεφάνων καὶ οἱ τῶν σωμάτων 
ἀσκηταὶ τοὺς γυμνικοὺς ἀγῶνας διαθλοῦσιν· ἐλπὶς εὐδαιμονίας καὶ τοὺς
ἀρετῆς ζηλωτὰς ἐπαίρει φιλοσοφεῖν, ὡς ταύτῃ δυνησομένους καὶ τὴν
τῶν ὄντων φύσιν ἰδεῖν καὶ δρᾶσαι τὰ ἀκόλουθα πρὸς τὴν τῶν ἀρίστων
βίων θεωρητικοῦ τε καὶ πρακτικοῦ τελείωσιν, ὧν ὁ τυχὼν εὐθύς ἐστιν"
31,Section11Sent4,εὐδαίμων.
32,Section12Sent1,"ἔνιοι μὲν οὖν τὰ ἐλπίδος σπέρματα ἢ ὡς πολέμιοι τὰς ἐν 
τῇ ψυχῇ κακίας ζωπυρήσαντες ἐνέπρησαν ἢ ὡς ἀμελεῖς τέχνης τῆς
γεωργικῆς ὑπὸ ῥᾳθυμίας διέφθειραν."
33,Section12Sent2,"εἰσὶ δ’ οἳ καὶ δόξαντες ἐπιμελεῖσθαι,
φιλαυτίαν πρὸ εὐσεβείας ἀσπασάμενοι, τὰς αἰτίας τῶν κατορθωμάτων
 ἀνέθηκαν ἑαυτοῖς."
34,Section13Sent1,"ὑπαίτιοι δὲ πάντες οὗτοι· μόνος δ’ ἀποδοχῆς
ἄξιος ὁ ἀναθεὶς τὴν ἐλπίδα θεῷ καὶ ὡς αἰτίῳ τῆς γενέσεως αὐτῆς καὶ"
35,Section13Sent2,ὡς ἀσινῆ καὶ ἀδιάφθορον ἱκανῷ μόνῳ διαφυλάξαι.
36,Section13Sent3,"τί οὖν ἆθλον πρόκειται
τῷ στεφανωθέντι τὸν ἀγῶνα τοῦτον; τὸ μικτὸν ἐκ θνητῆς καὶ
ἀθανάτου φύσεως ζῷον, ὁ ἄνθρωπος, οὔθ’ ὁ αὐτὸς οὔθ’ ἕτερος ὢν τοῦ
λαβόντος."
37,Section14Sent1,"τοῦτον Χαλδαῖοι μὲν προσονομάζουσιν Ἐνώς,"
38,Section14Sent2,"εἰς δ’ Ἑλλάδα  γλῶτταν μεταληφθείς ἐστιν ἄνθρωπος, τὸ κοινὸν ὄνομα τοῦ γένους
ἴδιον λαβών, ἆθλον ἐξαίρετον, ὡς δέον μηδένα νομίζεσθαι τὸ παράπαν
ἄνθρωπον, ὃς ἂν μὴ ἐπὶ θεὸν ἐλπίζῃ."
39,Section15Sent1,"Μετὰ δὲ τὴν ἐλπίδος νίκην ἀγὼν δεύτερός ἐστιν, ἐν ᾧ μετάνοια ἀγωνίζεται τῆς μὲν ἀτρέπτου καὶ ἀμεταβλήτου καὶ ἀεὶ κατὰ ταὐτὰ
 καὶ ὡσαύτως ἐχούσης φύσεως ἀμοιρήσασα,"
40,Section15Sent2,"ζήλῳ δὲ καὶ ἔρωτι τοῦ
βελτίονος ἐξαίφνης κατασχεθεῖσα καὶ σπεύδουσα καταλιπεῖν μὲν τὴν σύντροφον
πλεονεξίαν καὶ ἀδικίαν, μεθορμίσασθαι δὲ πρὸς σωφροσύνην καὶ
δικαιοσύνην καὶ τὰς ἄλλας ἀρετάς."
41,Section16Sent1,"ἆθλα καὶ ταύτῃ προτίθεται διττὰ ἐπὶ διττοῖς κατορθώμασιν, ἀπολείψει μὲν αἰσχρῶν, αἱρέσει δὲ τῶν καλλίστων."
42,Section16Sent2,τὰ δ’ ἆθλα ἀποικία καὶ μόνωσις·
43,Section16Sent3,"φησὶ   γὰρ ἐπὶ τοῦ τὰς μὲν
 σώματος νεωτεροποιίας ἀποδράντος, αὐτομολήσαντος δὲ πρὸς ψυχήν·"
44,Section17Sent1,"„οὐχ εὑρίσκετο, διότι μετέθηκεν αὐτὸν ὁ θεός“"
45,Section17Sent2,"(Gen. 5,24)."
46,Section17Sent3,"αἰνίττεται δὲ ἐναργῶς διὰ μὲν τῆς μεταθέσεως τὴν ἀποικίαν, διὰ δὲ τοῦ μὴ εὑρίσκεσθαι
τὴν μόνωσιν· καὶ σφόδρα οἰκείως·"
47,Section17Sent4,"εἰ γὰρ τῷ ὄντι ἄνθρωπος
 καταπεφρόνηκεν ἡδονῶν καὶ ἐπιθυμιῶν καὶ ἐπάνω τῶν παθῶν ἀψευδῶς
ἔγνωκεν ἵστασθαι, [πρὸς] μετανάστασιν εὐτρεπιζέσθω φεύγων ἀμεταστρεπτὶ
καὶ οἶκον καὶ πατρίδα καὶ συγγενεῖς καὶ φίλους."
48,Section18Sent1,"ὁλκὸν γὰρ ἡ συνήθεια, ὡς δέος εἶναι, μὴ καταμείνας ἁλῷ τοσούτοις ἐν κύκλῳ φίλτροις
ἀποληφθείς, ὧν αἱ φαντασίαι τὴν ἐγγενομένην ἡσυχίαν τῶν αἰσχρῶν
 ἐπιτηδευμάτων πάλιν ἀνακινήσουσι καὶ μνήμας ἐναύλους, ὧν ἐπιλελῆσθαι"
49,Section18Sent2,"καλὸν ἦν, ἐνεργάσονται."
50,Section19Sent1,"πολλοὶ γοῦν ἀποδημίαις ἐσωφρονίσθησαν, ἔρωτας
ἐκμανεῖς καὶ λελυττηκότας θεραπευθέντες, οὐκέτι τῆς ὄψεως χορηγεῖν
δυναμένης τῷ πάθει τῆς ἡδονῆς τὰ εἴδωλα·"
51,Section19Sent2,"τῇ γὰρ διαζεύξει κατὰ
 κενοῦ βαίνειν ἀνάγκη, μηκέτι παρόντος ὑφ’ οὗ διερεθισθήσεται."
52,Section20Sent1,"κἂν
μεταναστῇ μέντοι, τοὺς τῶν πολλῶν θιάσους ἐκτρεπέσθω μόνωσιν 
ἀσπαζόμενος·"
53,Section20Sent2,"πέφυκε γὰρ καὶ ἐπὶ τῆς ἀλλοδαπῆς ὅμοια τοῖς οἴκοι
δίκτυα, οἷς ἀνάγκη περιπείρεσθαι τοὺς ἀπροοράτως ἔχοντας καὶ ταῖς
τῶν πολλῶν χαίροντας ὁμιλίαις·"
54,Section20Sent3,"ὅ τι γὰρ ἄτακτον, ἄκοσμον, πλημμελές,
ὑπαίτιον, τοῦτο ὄχλος ἐστί, μεθ’ οὗ φέρεσθαι τῷ νῦν πρῶτον μετοικισαμένῳ
 πρὸς ἀρετὴν ἀλυσιτελέστατον."
55,Section21Sent1,"ὡς γὰρ τοῖς ἐκ νόσου μακρᾶς 
ἀρχομένοις ἀναλαμβάνειν εὐάλωτά πώς ἐστι τὰ σώματα μήπω πρὸς
ἰσχὺν παγέντα κραταιοτέραν,"
56,Section21Sent2,"οὕτως καὶ οἷς ἡ ψυχὴ νῦν πρῶτον ὑγιάζεται
πλαδῶσιν οἱ νοεροὶ τόνοι καὶ κραδαίνονται, ὡς δέος εἶναι, μὴ
πάλιν ἐξορμήσῃ τὸ πάθος, ὃ πέφυκεν ἐκ τῆς τῶν εἰκαιοτέρων συνδιαιτήσεως
ἀνερεθίζεσθαι."
57,Section22Sent1,"Μετὰ δὲ τοὺς μετανοίας ἀγῶνας τρίτα ἆθλα τίθεται δικαιοσύνης,
ἧς ὁ μεταποιησάμενος λαμβάνει γέρα διττά,"
58,Section22Sent2,"τὸ μὲν σωτήριον ἐν
κοινῇ φθορᾷ, τὸ δὲ ταμίαν καὶ φύλακα γενέσθαι ἐξ ἑκάστης ζῴων
ἰδέας ἡρμοσμένων ζυγάδην εἰς δευτέραν γένεσιν ἀντὶ τῆς ἀπολλυμένης."
59,Section23Sent1,"ἠξίωσε γὰρ ὁ ποιητὴς τὸν αὐτὸν καὶ τέλος γενέσθαι τῆς κατακρίτου 
γενεᾶς καὶ ἀρχὴν τῆς ἀνυπαιτίου, διδάσκων τοὺς ἀπρονόητον εἶναι τὸν"
60,Section23Sent2,"κόσμον λέγοντας ἔργοις, οὐ ῥήμασιν, ὅτι καθ’ ὃν εἰσηγήσατο νόμον ἐν
 τῇ φύσει τῶν ὅλων αἱ σύμπασαι μυριάδες τῶν ἀνθρώπων   μετὰ ἀδικίας
ζήσασαι ἑνὸς ἀνδρὸς οὐκ ἄξιαι δικαιοσύνῃ συμβιοῦντος. τοῦτον Ἕλληνες
μὲν Δευκαλίωνα, Χαλδαῖοι δὲ Νῶε ἐπονομάζουσιν, ἐφ’ οὗ τὸν μέγαν
 κατακλυσμὸν συνέβη γενέσθαι."
61,Section24Sent1,Μετὰ δὲ τὴν τριάδα ταύτην ἑτέρα τριὰς ὁσιωτέρα καὶ θεοφιλεστέρα γίνεται μιᾶς συγγενείας·
62,Section24Sent2,"πατὴρ γὰρ καὶ υἱὸς καὶ υἱωνὸς ἐπὶ τὸ αὐτὸ τέλος
ἔσπευσαν τοῦ βίου τὸ τῷ ποιητῇ καὶ πατρὶ τῶν ὅλων εὐαρεστῆσαι,"
63,Section24Sent3,"καταφρονήσαντες
μὲν ὧν θαυμάζουσιν οἱ πολλοί, δόξης καὶ πλούτου καὶ
 ἡδονῆς, γελάσαντες δὲ καὶ τῦφον, ὃς ἐκ ψευσμάτων ἀεὶ συνυφαίνεται καὶ
καταποικίλλεται πρὸς ἀπάτην τῶν ὁρώνταν."
64,Section25Sent1,"οὗτός ἐστιν ὁ γόης, ὁ τὰ ἄψυχα θεοπλαστῶν, ὁ μέγας καὶ δυσάλωτος ἐπιτειχισμός, οὗ τοῖς
σοφίσμασι καὶ στρατηγήμασι πᾶσα πόλις δελεάζεται προκαταλαμβάνοντος
τὰς τῶν νέων ψυχάς·"
65,Section25Sent2,"εἰσοικισάμενος γὰρ ἐκ πρώτης ἡλικίας ἄχρι
 γήρως ἐνίδρυται, πλὴν οἷς ἂν ὁ θεὸς αὐγὴν ἐπιλάμψῃ τῆς ἀληθείας·"
66,Section25Sent3,"ἀληθείᾳ δὲ τῦφος ἀντίπαλον,"
67,Section25Sent4,"ὃς μόλις μὲν ἀλλ’ οὖν κραταιοτέρᾳ δυνάμει
νικηθεὶς ὑπεξίσταται."
68,Section26Sent1,"τουτὶ δὲ τὸ γένος ἀριθμῷ μέν ἐστιν ὀλίγον,"
69,Section26Sent2,"δυνάμει δὲ πολὺ καὶ μέγιστον, ὡς μηδ’ ἅπαντα τὸν τῆς γῆς κύκλον
αὐτὸ χωρεῖν δύνασθαι,"
70,Section26Sent3,φθάνειν δ’ εἰς οὐρανόν·
71,Section26Sent4,"ἱμέρῳ γὰρ τοῦ θεωρεῖν
 καὶ τοῖς θείοις ἀεὶ συνεῖναι κατεσχημένον ἀλέκτῳ, τὴν ὁρατὴν ὅταν
ἅπασαν φύσιν διερευνήσῃ καὶ διεξέλθῃ, πρὸς τὴν ἀσώματον καὶ νοητὴν
εὐθὺς μέτεισιν, οὐδεμίαν τῶν αἰσθήσεων ἐπαγόμενον, ἀλλ’ ὅσον μὲν τῆς
ψυχῆς ἄλογον μεθιέμενον, τῷ δ’ ὃ κέκληται νοῦς καὶ λογισμὸς μόνῳ
προσχρώμενον."
72,Section27Sent1,"ὁ μὲν οὖν ἡγεμὼν τῆς θεοφιλοῦς δόξης, ὁ πρῶτος ἐκ  τύφου μεθορμισάμενος πρὸς ἀλήθειαν, διδακτικῇ χρησάμενος ἀρετῇ"
73,Section27Sent2,"πρὸς τελείωσιν, ἆθλον αἴρεται τὴν πρὸς θεὸν πίστιν·"
74,Section27Sent3,"τῷ δὲ κατ’ εὐμοιρίαν φύσεως αὐτήκοον καὶ αὐτομαθῆ καὶ αὐτοδίδακτον κτησαμένῳ τὴν
ἀρετὴν βραβεῖον ἀναδίδοται χαρά·"
75,Section27Sent4,"τοῦ δ’ ἀσκητοῦ καὶ πόνοις ἀτρύτοις
καὶ ἀκαμπέσι περιποιησαμένου"
76,Section27Sent5,"τὸ καλὸν ὁ στέφανός ἐστιν ὅρασις θεοῦ.
τοῦ δὲ πιστεύειν θεῷ καὶ διὰ παντὸς τοῦ βίου χαίρειν καὶ ὁρᾶν ἀεὶ τὸ 
ὂν τί ἂν ὠφελιμώτερον ἢ σεμνότερον ἐπινοήσειέ τις"
77,Section27Sent6,;
78,Section28Sent1,"Ἐπαυγασώμεθα δ’ αὐτῶν ἕκαστον ἀκριβέστερον, μὴ τοῖς
ὀνόμασι παραχθέντες, ἀλλὰ διακύψαντες εἴσω καὶ ταῖς διανοίαις ἐμβαθύναντες."
79,Section28Sent2,"ὁ μὲν τοίνυν ἀψευδῶς πιστεύσας θεῷ τὴν ἐν τοῖς ἄλλοις
ὅσα γενητὰ καὶ φθαρτὰ κατείληφεν ἀπιστίαν, ἀρξάμενος ἀπὸ τῶν ἐν 
αὐτῷ μέγα πνεόντων, λογισμοῦ τε καὶ αἰσθήσεως·"
80,Section28Sent3,"ἑκατέρῳ γὰρ ἴδιον
  συνέδριον καὶ δικαστήριον προσκεκλήρωται, τῷ μὲν εἰς τὴν τῶν νοητῶν
ἐπίσκεψιν, οὗ τέλος ἀλήθεια,"
81,Section28Sent4,"τῇ δὲ εἰς τὴν τῶν ὁρατῶν, οὗ τέλος δόξα."
82,Section29Sent1,τὸ μὲν οὖν ἀνίδρυτον καὶ πεπλανημένον τῆς δόξης ἐνθένδε δῆλον·
83,Section29Sent2,"εἰκόσι
γὰρ καὶ πιθανοῖς ἐφορμεῖ·"
84,Section29Sent3,"πᾶσα δὲ εἰκὼν ὁμοιότητι εὐπαραγώγῳ ψεύδεται 
τὸ ἀρχέτυπον. ὅ τε ἡγεμὼν αἰσθήσεως λογισμὸς τὰς κρίσεις οἰόμενος
ἀνῆφθαι τῶν νοητῶν καὶ κατὰ τὰ αὐτὰ καὶ ὡσαύτως ἐχόντων ἁλίσκεται
περὶ πολλὰ κηραίνων·"
85,Section29Sent4,"ὅταν γὰρ μυρίοις οὖσι τοῖς κατὰ μέρος ποιῆται
τὰς προσβολάς, ἀδυνατεῖ καὶ ἐξασθενεῖ καὶ ἀπαγορεύει καθάπερ ἀθλητὴς
 ὑπὸ ῥώμης δυνατωτέρας ἐκτραχηλιζόμενος."
86,Section30Sent1,"ὅτῳ δ’ ἐξεγένετο πάντα μὲν 
σώματα πάντα δ’ ἀσώματα ὑπεριδεῖν καὶ ὑπερκῦψαι, μόνῳ δ’ ἐπερείσασθαι
καὶ στηρίσασθαι θεῷ μετ’ ἰσχυρογνώμονος λογισμοῦ καὶ ἀκλινοῦς
καὶ βεβαιοτάτης πίστεως, εὐδαίμων καὶ τρισμακάριος οὗτος ὡς ἀληθῶς."
87,Section31Sent1,"Μετὰ πίστιν προὔκειτο τῷ περιπεποιημένῳ τὴν ἀρετὴν ἐκ φύσεως
ἀκονιτὶ καὶ νικηφορήσαντι χαρὰ τὸ ἆθλον· ὠνομάσθη γάρ, ὡς μὲν ἂν"
88,Section31Sent2,"εἴποιεν Ἕλληνες, γέλως,"
89,Section31Sent3,"ὡς δὲ Χαλδαῖοι προσονομάζουσιν, Ἰσαάκ·
γέλως δὲ σημεῖον ἐπὶ τοῦ σώματος φανερὸν ἀφανοῦς τῆς κατὰ διάνοιαν"
90,Section31Sent4,χαρᾶς ἐστι.
91,Section32Sent1,"χαρὰν δὲ τῶν εὐπαθειῶν ἀρίστην καὶ καλλίστην εἶναι συμβέβηκεν, ὑφ’ ἧς ὅλη δι’ ὅλων εὐθυμίας ἡ ψυχὴ καταπίμπλαται,
 γεγηθυῖα μὲν ἐπὶ τῷ πατρὶ καὶ ποιητῇ τῶν συμπάντων θεῷ,"
92,Section32Sent2,"γεγηθυῖα
δὲ καὶ ἐπὶ τοῖς ἄνευ κακίας δρωμένοις, κἂν μὴ τυγχάνῃ καθ’ ἡδονὴν
ὄντα, ὡς καλῶς γινομένοις καὶ ἐπὶ τῇ τῶν ὅλων διαμονῇ."
93,Section33Sent1,"καθάπερ γὰρ ἰατρὸς μὲν ἐν ταῖς μεγάλαις καὶ ἐπισφαλέσι νόσοις ἔστιν ὅτε μέρη
σωμάτων ἀφαιρεῖ στοχαζόμενος τῆς τοῦ λοιποῦ σώματος ὑγείας,"
94,Section33Sent2,"κυβερνήτης
 δὲ χειμώνων ἐπιγινομένων ἀποφορτίζεται προνοίᾳ τῆς τῶν ἐμπλεόντων
σωτηρίας, καὶ μέμψις οὔτε τῷ ἰατρῷ τῆς πηρώσεως οὔτε τῷ
κυβερνήτῃ τῆς ἀποβολῆς ἕπεται,"
95,Section33Sent3,"τοὐναντίον δὲ ἔπαινος ἑκατέρῳ τὸ συμφέρον
πρὸ τοῦ ἡδέος ἰδόντι καὶ κατορθώσαντι,"
96,Section34Sent1,"τὸν αὐτὸν τρόπον καὶ τὴν τῶν ὅλων φύσιν ἀεὶ θαυμαστέον καὶ τοῖς ἐν τῷ κόσμῳ πραττομένοις
 ἅπασιν ἄνευ τῆς ἑκουσίου κακίας εὐαρεστητέον ἐξετάζοντας, οὐκ εἴ
τι μὴ καθ’ ἡδονὴν ἰδίαν συμβέβηκεν, ἀλλ’ εἰ τρόπον εὐνόμου πόλεως ὁ
κόσμος ἡνιοχεῖταί τε καὶ κυβερνᾶται σωτηρίως."
97,Section35Sent1,"μακάριος οὖν καὶ οὗτος οὐχ ἧττον τοῦ προτέρου, συννοίας καὶ κατηφείας ἀμέτοχος ὤν, ἄλυπόν τε
καὶ ἄφοβον ζωὴν καρπούμενος, αὐστηροῦ καὶ αὐχμηροῦ βίου μηδ’ ὄναρ
 προσαψάμενος διὰ τὸ   πάντα τόπον τῆς ψυχῆς αὐτοῦ χαρᾷ προκατέχεσθαι."
98,Section36Sent1,Μετὰ τὸν αὐτομαθῆ δὲ καὶ πλουσίᾳ χρησάμενον τῇ φύσει τρίτος ὁ ἀσκητὴς τελειοῦται λαμβάνων γέρας ἐξαίρετον ὅρασιν θεοῦ.
99,Section36Sent2,πάντων γὰρ τῶν κατὰ τὸν ἀνθρώπινον βίον ἐφαψάμενος καὶ πᾶσιν
100,Section36Sent3,"ἐνομιλήσας οὐ παρέργως καὶ μηδένα πόνον ἢ κίνδυνον παρελθών,"
101,Section36Sent4,"εἴ
πως δυνηθείη τὴν ἀξιέραστον ἀλήθειαν ἰχνηλατῆσαι, παρὰ τῷ θνητῷ
γένει πολὺν ζόφον ἀνεύρισκε κατὰ γῆν καὶ ὕδωρ καὶ ἀέρα καὶ αἰθέρα·"
