,ID,StringText
415,Section139Sent1,"δουλεύοντες γὰρ
πικρῶν μὲν ἐπιταγμάτων ὑπηρεσίας ἀναδέξονται τοῖς σώμασι,"
416,Section139Sent2,"πικροτέρων
δὲ θεαμάτων ἀνίαις κατατεινόμενοι τὰς ψυχὰς ἀπαγορεύσουσιν·"
417,Section139Sent3,"ὄψονται
γὰρ ὧν συνῳκοδόμησαν ἢ κατεφύτευσαν ἢ περιεποιήσαντο κληρονόμους 
γεγονότας ἐχθρούς, ἀλλοτρίων ἀπολαύοντας ἀγαθῶν καὶ ἑτοίμων· ὄψονται
καὶ τὰ πίονα τῶν ἰδίων θρεμμάτων εὐωχουμένους, ἱερεύοντας καὶ
παραρτύοντας εἰς ἀπόλαυσιν ἡδίστην, οἱ στερόμενοι τοὺς ἀφελομένους·
ὄψονται καὶ γυναῖκας, ἃς ἠγάγοντο κουριδίας ἐπὶ γνησίων παίδων σπορᾷ,"
418,Section139Sent4,"σώφρονας καὶ οἰκουροὺς καὶ φιλάνδρους ἑταιρῶν τρόπον ὑβριζομένας.
καὶ πρὸς μὲν ἄμυναν ὁρμήσουσιν,"
419,Section140Sent1,ἔξω δὲ τοῦ σφαδᾴζειν οὐδὲν ἐργάσασθαι δυνήσονται πᾶσαν ἰσχὺν ἐκτετμημένοι καὶ ἐκνενευρισμένοι·
420,Section140Sent2,"προκείσονται
γὰρ σκοποὶ τοῖς ἐθέλουσιν ἄγειν, φέρειν, ἁρπάζειν, ὑβρίζειν,
 τιτρώσκειν, εἰς βλάβας, εἰς αἰκίας, εἰς πανωλεθρίαν, ὡς μηδὲν ἀφεθῆναι
τῶν βλημάτων κωφόν, ἀλλ’ εὔσκοπα καὶ εὔστοχα πάντα."
421,Section141Sent1,"Ἐπάρατοι μὲν ἐν πόλεσι καὶ κώμαις,"
422,Section141Sent2,ἐπάρατοι δ’ ἐν οἰκίαις καὶ ἐπαύλεσιν ἔσονται·
423,Section141Sent3,"ἐπάρατος μὲν ἡ πεδιὰς καὶ ὅσα κατεβλήθη σπέρματα,"
424,Section141Sent4,"ἐπάρατος
δὲ ἡ βαθύγειος τῆς ὀρεινῆς καὶ ὅσα γένη δένδρων ἡμέρων· ἐπάρατοι
 τῶν θρεμμάτων αἱ ἀγέλαι,"
425,Section141Sent5,στειρωθήσονται γὰρ πρὸς ἀγονίαν·
426,Section141Sent6,"ἐπάρατοι
πάντες οἱ καρποί,"
427,Section141Sent7,τῷ γὰρ καιριωτάτῳ τῆς ἀκμῆς ἀνεμόφθοροι γενήσονται.
428,Section142Sent1,"τὰ πλήρη ταμεῖα τροφῶν καὶ χρημάτων κενωθήσεται· πόρος οὐδεὶς εὐοδήσει, τέχναι πᾶσαι, πραγματεῖαι πολύτροποι, βίων ἰδέαι
μυρίων τοῖς χρωμένοις οὐδὲν ὄφελος·"
429,Section142Sent2,"ἀτελεῖς γὰρ αἱ τῶν σπουδαζομένων
   ἐλπίδες ἔσονται καὶ συνόλως ὅτου ἐφάψονται διὰ πονηρῶν ἐπιτηδευμάτων
 ἢ ἔργων, ὧν κεφαλὴ καὶ τέλος ἀπόλειψις θεραπείας θεοῦ·"
430,Section142Sent3,"τὰ
γὰρ ἀσεβείας καὶ παρανομίας ἐπίχειρα ταῦτα."
431,Section143Sent1,"Καὶ πρὸς τούτοις αἱ σωματικαὶ νόσοι μέλος ἕκαστον καὶ μέρος ἰδίᾳ κατεργαζόμεναι καὶ διεσθίουσαι καὶ πάλιν ὅλα δι’ ὅλων καταξαίνουσαι,
 πυρετοῖς, ῥίγεσι, φθινάσι τηκεδόσι, ψώραις ἀγρίαις, ἰκτέροις,
σφακελίζουσιν ὀφθαλμοῖς, ἕλκεσιν ὑποπύοις καὶ ἑρπηνώδεσι κατὰ πάσης
χεομένοις τῆς δορᾶς, κακώσεσι τῶν ἐντοσθίων, ἀνατροπαῖς στομάχου,
τῶν ἐν πνεύμονι πόρων ἀποφράξεσιν ὑπὲρ τοῦ μὴ εὐοδεῖν τὴν ἀναπνοήν"
432,Section143Sent2,"— πάρεσις γλώσσης, κώφωσις ὤτων, πήρωσις ὀφθαλμῶν, τῶν ἄλλων"
433,Section143Sent3,"ἀμυδρότης αἰσθήσεων καὶ σύγχυσις, καίτοι δεινὰ ὄντα, συγκρινόμενα
 βαρυτέροις οὐ φαίνεται δεινά —,"
434,Section144Sent1,"τοῦ μὲν ἐν φλεψὶν αἵματος ἀποβαλόντος
ὅσον ἦν ἐν αὐτῷ ζωτικόν,"
435,Section144Sent2,"τοῦ δ’ ἐν ἀρτηρίαις πνεύματος τὴν ἔξωθεν
ἀπὸ τοῦ συμφυοῦς ἀέρος μηκέθ’ ὁμοίως ἐπιδεχομένου σωτήριον κρᾶσιν,"
436,Section144Sent3,τῶν δὲ νεύρων ἀνεθέντων καὶ χαλασθέντων·
437,Section145Sent1,"οἷς ἐπακολουθεῖ τῆς ἁρμονίας 
καὶ συμφωνίας τῶν μελῶν πάρεσις πρότερον πονηθέντων ἁλμυροῦ καὶ
πάνυ πικροῦ φορᾷ ῥεύματος εἴσω παραδυομένου καί, ὁπότε στενοῖς ἐγκατακλεισθείη
πόροις εὐμαρεῖς διεξόδους οὐκ ἔχουσι, θλιβομένου τε καὶ
θλίβοντος εἰς πικρῶν καὶ δυσυπομονήτων γένεσιν ἀλγηδόνων, ἐξ ὧν
φύεται τὰ ποδαγρικὰ καὶ ἀρθριτικὰ πάθη καὶ νοσήματα, πρὸς ἃ σωτήριον 
οὐδὲν ἐπενοήθη φάρμακον, ἀλλ’ ἔστιν ἀνθρωπίναις ἐπινοίαις ἀνίατα."
438,Section146Sent1,"ταῦτα ὁρῶντες ἔνιοι καταπλαγήσονται, πῶς οἱ πρὸ μικροῦ πίονες εὔσαρκοί
τε καὶ εὐεξίᾳ μάλιστα θάλλοντες"
439,Section146Sent2,"οὕτως αἰφνίδιον ἐκτακέντες ῥικνοὶ
γεγόνασιν ἶνες αὐτὸ μόνον καὶ λεπτὴ δορά, καὶ πῶς γυναῖκες ἁβροδίαιτοι
καὶ πανάπαλοι διὰ τὴν ἐκ πρώτης ἡλικίας συναυξηθεῖσαν τρυφὴν ὑπὸ 
 κακώσεως δεινῆς ἅμα ταῖς ψυχαῖς καὶ τὰ σώματα ἐξηγρίωνται"
440,Section146Sent3,.
441,Section147Sent1,"τότε
δὴ τότε διώξονται μὲν ἐχθροὶ καὶ μάχαιρα ἐκδικήσει δίκην,"
442,Section147Sent2,"οἱ δ’ εἰς
τὰς πόλεις καταφεύγοντες, ὅταν ἐν ἀσφαλεῖ γεγενῆσθαι νομίσωσιν,
ἐλπίδος ἀπάτῃ φενακισθέντες ἡβηδὸν ἀπολοῦνται προκαταδύντες ἐνέδραις
ἐχθρῶν."
443,Section148Sent1,"Κἂν εἰ ἐπὶ τούτοις μὴ σωφρονίζοιντο πλαγιάζοντες καὶ τὰς
ἐπ’ ἀλήθειαν ἀγούσας εὐθυτενεῖς ὁδοὺς ἐκτρεπόμενοι, δειλία καὶ φόβος
ταῖς ψυχαῖς αὐτῶν ἐνιδρυθήσεται, καὶ φεύξονται μὲν οὐδενὸς διώκοντος,"
444,Section148Sent2,"φήμαις δὲ οἷα φιλεῖ ψευδέσι πεσοῦνται προτροπάδην, φύλλου τε κτύπος
  κουφότατος δι’ ἀέρος φερόμενος τοσαύτην ἀγωνίαν καὶ πτοίαν ἐργάσεται"
445,Section148Sent3,","
446,Section148Sent4,"ὅσην ὁ τραχύτατος πόλεμος ἐκ δυνατωτέρων ἐχθρῶν, ὡς καὶ τέκνα
γονέων καὶ γονεῖς τέκνων καὶ ἀδελφοὺς ἀδελφῶν ὑπεριδεῖν, ἐκ μὲν τῆς
ἀλλήλων ἐπιβοηθείας ἅλωσιν προσδοκήσαντας, σωτηρίαν δ’ ἐκ τοῦ
ἑαυτοὺς ἀποδιδράσκειν ἕκαστον."
447,Section149Sent1,πονηρῶν δὲ ἀνθρώπων ἀτελεῖς ἐλπίδες·
448,Section149Sent2,"μᾶλλον γὰρ ἢ οὐχ ἧττον οἱ διαπεφευγέναι δόξαντες τῶν προκαταληφθέντων
ἁλώσονται. κἂν διαλάθωσι μέντοι τινές, ἐφεδρείαν δ’ ἕξουσι
τῶν φύσει πολεμίων·"
449,Section149Sent3,"οὗτοι δέ εἰσιν ἀγριώτατοι θῆρες ἐξ ἑαυτῶν εὐοπλοῦντες,
οὓς ὁ θεὸς ἅμα τῇ πρώτῃ γενέσει τοῦ παντὸς ἐδημιούργει
πρὸς ἀνθρώπων τῶν μὲν δυναμένων νουθετεῖσθαι φόβον"
450,Section149Sent4,"τῶν δὲ ἀνιάτως
 ἐχόντων ἀπαραίτητον δίκην."
451,Section150Sent1,"ἀπιστήσουσι μὲν οἱ θεασάμενοι τὰς αὐτοῖς θεμελίοις ἀναιρεθείσας πόλεις, εἰ πώποτε ᾠκίσθησαν·"
452,Section150Sent2,"ἐν εἴδει δὲ παροιμίας
θήσονται τὰς ἐκ λαμπρῶν εὐτυχημάτων ἐξαπιναίους κακοπραγίας, ὅσαι
καὶ ἀνεγράφησαν"
453,Section150Sent3,καί εἰσιν ἄγραφοι.
454,Section151Sent1,"παρελεύσονται καὶ μέχρι σπλάγχνων αἱ τηκεδόνες ἀθυμίας τε καὶ ἀδημονίας ἐμποιοῦσαι σὺν ἐκθλίψει. ζωὴν
 ἀνίδρυτον καὶ κρεμαμένην ὥσπερ ἐξ ἀγχόνης ἐργάσονται φόβου διαδοχαὶ
μεθ’ ἡμέραν τε καὶ νύκτωρ τὴν ψυχὴν ἄνω καὶ κάτω κλονοῦσαι, ὡς
πρωΐας μὲν ἑσπέραν ἑσπέρας δὲ ὄρθρον εὔχεσθαι διὰ τὰς καὶ ἐγρηγορότων
κακώσεις ἐμφανεῖς καὶ κοιμωμένων ἐξ ὀνειράτων ἀποτροπαίους
φαντασίας."
455,Section152Sent1,"ὁ μὲν ἔπηλυς ἄνω ταῖς εὐτυχίαις μετέωρος ἀρθεὶς περίβλεπτος  ἔσται, θαυμαζόμενος καὶ μακαριζόμενος ἐπὶ δυσὶ τοῖς καλλίστοις,
τῷ τε αὐτομολῆσαι πρὸς θεὸν καὶ τῷ γέρας λαβεῖν οἰκειότατον τὴν ἐν
οὐρανῷ τάξιν βεβαίαν, ἣν οὐ θέμις εἰπεῖν,"
456,Section152Sent2,"ὁ δ’ εὐπατρίδης παρακόψας
τὸ νόμισμα τῆς εὐγενείας ὑποσυρήσεται κατωτάτω πρὸς αὐτὸν τάρταρον"
457,Section152Sent3,"καὶ βαθὺ σκότος ἐνεχθείς, ἵνα ταῦτα ὁρῶντες τὰ παραδείγματα πάντες
ἄνθρωποι σωφρονίζωνται, μανθάνοντες ὅτι τὴν ἐκ δυσγενείας ἀρετὴν
φυομένην θεὸς ἀσπάζεται, τὰς μὲν ῥίζας ἐῶν χαίρειν, τὸ δὲ στελεχωθὲν
ἔρνος, ὅτι μετέβαλεν ἡμερωθὲν πρὸς εὐκαρπίαν, ἀποδεχόμενος."
458,Section153Sent1,"Οὕτως καθάπερ ὑπὸ πυρὸς δαπανηθεισῶν τῶν πόλεων καὶ 
τῆς χώρας ἐρημωθείσης, ἄρξεταί ποτε διαπνεῖν καὶ ἀνακύπτειν ἡ πολλὰ
γυμνασθεῖσα καὶ τραχηλισθεῖσα γῆ πρὸς οἰκητόρων ἀφορήτου βίας, οἳ
τὰς παρθένους   ἑβδομάδας ὑπερορίους καὶ τῆς χώρας καὶ τῆς αὑτῶν
διανοίας ἀπήλασαν."
459,Section153Sent2,"μόνας γὰρ ἢ τό γε ἀσφαλέστερον εἰπεῖν πρώτας
ἀνέδειξεν ἑορτὰς ἡ φύσις τὰς ἑβδομάδας ἡμερῶν τε καὶ ἐνιαυτῶν, πρὸς 
 ἀνάπαυλαν ἀνθρώποις μὲν τὰς ἡμερῶν, τῇ δὲ χώρᾳ τὰς ἐνιαυτῶν."
460,Section154Sent1,"οἱ
δ’ ὅλον τοῦτον παρακαλυψάμενοι τὸν νόμον, τοὺς ἅλας, τὰς σπονδάς,
τὸν ἐλέου βωμόν, τὴν κοινὴν ἑστίαν, ἐξ ὧν φιλία καὶ ὁμόνοια ἡρμόζετο"
461,Section154Sent2,"— πάντα γὰρ δι’ ἑβδομάδος καὶ ἑβδομάς —, ἐβάρυναν μὲν ἀνθρώπους
ἀσθενεστέρους οἱ δυνατώτεροι συνεχέσι καὶ ἀδιαστάτοις ἐπιτάγμασιν,"
462,Section154Sent3,"ἐβάρυναν δὲ καὶ τὰς ἀρούρας ἀεὶ κέρδη μεταδιώκοντες ἐκ πλεονεξιῶν
ἄδικα, ταῖς ἐπιθυμίαις ἐφιστάντες ἀχαλίνους καὶ ἀδίκους ὁρμὰς εἰς τὸ
 ἀκόρεστον"
463,Section154Sent4,.
464,Section155Sent1,"ἀντὶ γὰρ τοῦ παρασχεῖν μὲν ἀνθρώποις, κατὰ τὸν ἀψευδέστατον
λόγον ἀδελφοῖς, ὧν μία μήτηρ ἡ κοινὴ φύσις, τὰς προστεταγμένας
δι’ ἓξ ἡμερῶν ἐκεχειρίας,"
465,Section155Sent2,"παρέχειν δὲ καὶ τῇ χώρᾳ τὰς δι’ ἓξ 
ἐνιαυτῶν ἀνέσεις μήτε σποραῖς μήτε φυτείαις βαρύνοντας, ἵνα μὴ
 καμάτοις ἐπαλλήλοις ἀπαγορεύσῃ"
466,Section155Sent3,","
467,Section156Sent1,"ἀμελήσαντες τουτωνὶ τῶν χρηστῶν
παραινέσεων εἰς ἡμερότητα προκαλουμένων"
468,Section156Sent2,"τὰ μὲν σώματα καὶ τὰς
ψυχὰς ὧν ἐδύναντο πάντων ἀνάγκαις ἀτρύτοις ἐπίεσαν,"
469,Section156Sent3,"τῆς βαθυγείου δὲ
τὴν ἰσχὺν ὑπετέμοντο φοραῖς ταῖς ὑπὲρ δύναμιν ἀπλήστως προσοδευόμενοι"
470,Section156Sent4,"καὶ δασμοῖς οὐκ ἐτησίοις μόνον ἀλλὰ καὶ ἐφημέροις ὅλην δι’ ὅλων
ἐκτραχηλίζοντες."
471,Section157Sent1,"ὑπὲρ ὧν οἱ μὲν τὰς λεχθείσας ἀρὰς καὶ δίκας ἀναπλήσουσιν,"
472,Section157Sent2,"ἡ δ’ ἐκνευρισθεῖσα χώρα καὶ μυρίας ὑπομείνασα κακώσεις,
ἀποφορτισαμένη τὸ τῶν ἀσεβῶν οἰκητόρων ἄχθος, ἐπελαφρισθήσεται·"
473,Section157Sent3,"καὶ ὅταν ἐν κύκλῳ περιβλεψαμένη μηδένα θεάσηται τῶν καθελόντων
αὐτῆς τὸ μεγαλαύχημα καὶ ἀξίωμα,"
474,Section157Sent4,"ἀλλὰ κενὰς μὲν αὐτῆς τὰς ἀγορὰς
θορύβων καὶ πολέμων καὶ ἀδικημάτων,"
475,Section157Sent5,"πλήρεις δὲ ἡσυχίας καὶ εἰρήνης
καὶ δικαιοσύνης, ἀνηβήσει καὶ ἐπακμάσει καὶ τοὺς τῶν ἱερῶν ἑβδομάδων
καιροὺς ἑορτώδεις ἠρεμήσει καὶ ἀναπαύσεται συλλεγομένη καθάπερ
 ἀθλητὴς προηγωνισμένος δύναμιν."
476,Section158Sent1,"εἶθ’ οἷα μήτηρ φιλόστοργος οἰκτιεῖται μὲν υἱοὺς καὶ θυγατέρας οὓς ἀπέβαλεν, οἳ καὶ ἀποθανόντες καὶ ζῶντες
ἔτι μᾶλλον ὀδύναι τοῖς τοκεῦσιν ἐγένοντο·"
477,Section158Sent2,"πάλιν δὲ νεάσασα εὐφορήσει
καὶ τέξεται γενεὰν ἀνεπίληπτον, ἐπανόρθωμα τῆς προτέρας·"
478,Section158Sent3,"ἡ γὰρ
 ἔρημος, ᾗ φησιν ὁ προφήτης, εὔτεκνός   τε καὶ πολύπαις, ὅπερ λόγιον
 καὶ ἐπὶ ψυχῆς ἀλληγορεῖται."
479,Section159Sent1,"πολλὴ μὲν γὰρ ὅταν ᾖ, παθῶν καὶ κακιῶν ἀνάπλεως, οἷα περικεχυμένων αὐτῇ τέκνων, ἡδονῶν, ἐπιθυμιῶν,
ἀφροσύνης, ἀκολασίας, ἀδικίας, ἀσθενεῖ καὶ νοσεῖ καὶ ἐπικήρως ἔχουσα
θανατᾷ,"
480,Section159Sent2,στειρωθεῖσα δὲ καὶ ἀγονήσασα τούτων ἢ καὶ ἀποβαλοῦσα ἀθρόα
481,Section159Sent3,γίνεται μὲν ἐκ μεταβολῆς ἁγνὴ παρθένος
482,Section159Sent4,","
483,Section160Sent1,"παραδεξαμένη δὲ τὸν θεῖον  σπόρον διαπλάττει καὶ ζῳογονεῖ περιμαχήτους φύσεις, θαυμαστὰ κάλλη,
φρόνησιν, ἀνδρείαν, σωφροσύνην, δικαιοσύνην, ὁσιότητα, εὐσέβειαν, τὰς
ἄλλας ἀρετάς τε καὶ εὐπαθείας, ὧν οὐ μόνον ἡ γένεσις εὔτεκνος ἀγαθόν,
ἀλλὰ καὶ ἡ προσδοκία τῆς γενέσεως ἐλπίδι προγανοῦσα τὴν ἀσθένειαν."
484,Section161Sent1,"ἐλπὶς δὲ χαρὰ πρὸ χαρᾶς ἐστιν, εἰ καὶ ἐνδεὴς παρὰ τελείαν, ἀλλά τοι"
485,Section161Sent2,"τῆς ἐπιγινομένης καθ’ ἑκάτερα βελτίων, ὅτι τε τὸ αὐχμηρὸν ἀναχαλᾷ
καὶ λιπαίνει τῶν φροντίδων καὶ ὅτι φθάνουσα τὸ μέλλον καὶ πλῆρες
ἀγαθὸν εὐαγγελίζεται."
486,Section162Sent1,"Τὰς μὲν οὖν ἀρὰς καὶ τιμωρίας, ἃς ὑπομένειν ἄξιον τοὺς τῶν
ἱερῶν νόμων δικαιοσύνης καὶ εὐσεβείας ὑπερορῶντας καὶ ταῖς πολυθέοις 
δόξαις ὑπαχθέντας, ὧν ἀθεότης τὸ τέλος, λήθῃ τῆς συγγενοῦς καὶ
πατρίου διδασκαλίας, ἣν ἐκ πρώτης ἡλικίας ἐπαιδεύθησαν τὴν τοῦ ἑνὸς
φύσιν τὸν ἀνωτάτω νομίζειν θεόν, ᾧ δεῖ μόνῳ προσκεκληρῶσθαι τοὺς
ἄπλαστον ἀλήθειαν ἀντὶ πεπλασμένων μύθων μεταδιώκοντας, οὐδὲν
 ὑποστειλάμενος δεδήλωκα."
487,Section163Sent1,"ἐὰν μέντοι μὴ ἐπ’ ὀλέθρῳ δέξωνται τὰς 
δυνάμεις μᾶλλον ἢ νουθεσίᾳ καὶ καταιδεσθέντες ὅλῃ ψυχῇ μεταβάλωσι,
κακίσαντες μὲν αὑτοὺς τῆς πλάνης,"
488,Section163Sent2,"ἐξαγορεύσαντες δὲ καὶ ὁμολογήσαντες
ὅσα ἥμαρτον καθ’ αὑτοὺς διανοίᾳ κεκαθαρμένῃ τὸ πρῶτον εἰς τὸ τοῦ
συνειδότος ἀψευδὲς καὶ ἀνύπουλον, ἔπειτα καὶ γλώττῃ πρὸς βελτίωσιν
τῶν ἀκουόντων, εὐμενείας τεύξονται τῆς τοῦ σωτῆρος καὶ ἵλεω θεοῦ τῷ 
γένει τῶν ἀνθρώπων ἐξαίρετον παρασχομένου καὶ μεγίστην δωρεάν, τὴν
πρὸς τὸν αὐτοῦ λόγον συγγένειαν, ἀφ’ οὗ καθάπερ ἀρχετύπου γέγονεν
 ὁ ἀνθρώπινος νοῦς·"
489,Section164Sent1,"κἂν γὰρ ἐν ἐσχατιαῖς ὦσι γῆς δουλεύοντες παρὰ
τοῖς αἰχμαλώτους αὐτοὺς ἀπάγουσιν ἐχθροῖς, ὥσπερ ἀφ’ ἑνὸς συνθήματος
ἡμέρᾳ μιᾷ πάντες ἐλευθερωθήσονται, τῆς ἀθρόας πρὸς ἀρετὴν μεταβολῆς 
κατάπληξιν ἐργασαμένης τοῖς δεσπόταις·"
490,Section164Sent2,μεθήσονται γὰρ αὐτοὺς αἰδεσθέντες
491,Section165Sent1,κρειττόνων ἄρχειν.
492,Section165Sent2,"ὅταν δὲ τύχωσι τῆς ἀπροσδοκήτου
ταύτης ἐλευθερίας, οἱ πρὸ μικροῦ σποράδες ἐν Ἑλλάδι καὶ βαρβάρῳ
κατὰ νήσους καὶ κατὰ ἠπείρους ἀναστάντες   ὁρμῇ μιᾷ πρὸς ἕνα συντενοῦσιν
ἀλλαχόθεν ἄλλοι τὸν ἀποδειχθέντα χῶρον, ξεναγούμενοι πρός 
τινος θειοτέρας ἢ κατὰ φύσιν ἀνθρωπίνην"
493,Section165Sent3,"ὄψεως, ἀδήλου μὲν ἑτέροις,"
494,Section165Sent4,μόνοις δὲ τοῖς ἀνασῳζομένοις ἐμφανοῦς
495,Section165Sent5,","
496,Section166Sent1,"τρισὶ χρησάμενοι παρακλήτοις τῶν πρὸς τὸν πατέρα καταλλαγῶν, ἑνὶ μὲν ἐπιεικείᾳ καὶ χρηστότητι τοῦ
παρακαλουμένου συγγνώμην πρὸ τιμωρίας ἀεὶ τιθέντος, δευτέρῳ δὲ τῇ
τῶν ἀρχηγετῶν τοῦ ἔθνους ὁσιότητι, ὅτι ταῖς ἀφειμέναις σωμάτων ψυχαῖς
 ἄπλαστον καὶ γυμνὴν ἐνδεικνύμενοι πρὸς τὸν ἄρχοντα θεραπείαν τὰς ὑπὲρ
υἱῶν καὶ θυγατέρων ἱκετείας οὐκ ἀτελεῖς εἰώθασι ποιεῖσθαι, γέρας αὐτοῖς
παρέχοντος τοῦ πατρὸς τὸ ἐπήκοον ἐν εὐχαῖς"
497,Section166Sent2,","
498,Section167Sent1,"τρίτῳ δὲ δι’ ὃ μάλιστα καὶ ἡ τῶν λεχθέντων εὐμένεια φθάνει προαπαντῶσα,"
499,Section167Sent2,"τοῦτο δέ ἐστι
βελτίωσις τῶν ἀγομένων εἰς σπονδὰς καὶ συμβάσεις, οἳ μόλις ἐξ ἀνοδίας
 εἰς ὁδὸν ἐδυνήθησαν ἐλθεῖν, ἧς τὸ πέρας οὐδὲν ἕτερον ἢ εὐαρεστεῖν τῷ
θεῷ καθάπερ υἱοὺς πατρί."
500,Section168Sent1,"παραγενομένων δὲ πολισθήσονται πάλιν αἱ ἐρείπιοι γενόμεναι πρὸ μικροῦ καὶ ἡ ἔρημος οἰκισθήσεται καὶ ἡ στειρωθεῖσα
γῆ μεταβαλεῖ πρὸς εὐγονίαν· αἵ τε πατέρων καὶ προγόνων
εὐτυχίαι βραχὺ μέρος εἶναι νομισθήσονται διὰ τὰς ἀφθόνους τῶν ἐν
 χερσὶ περιουσίας, αἳ καθάπερ ἀπ’ ἀενάων πηγῶν τῶν τοῦ θεοῦ χαρίτων
ῥέουσαι βαθὺν πλοῦτον ἰδίᾳ τε ἑκάστῳ καὶ πᾶσι κοινῇ περιποιήσουσι
φθόνου κρείττονα."
501,Section169Sent1,μεταβολὴ δὲ πάντων ἐξαπιναίως ἔσται·
502,Section169Sent2,"τρέψει γὰρ ὁ θεὸς τὰς ἀρὰς ἐπὶ τοὺς τῶν μετανενοηκότων ἐχθρούς, οἵτινες κακοπραγίαις
τοῦ ἔθνους ἐφήδοντο κατακερτομοῦντες καὶ ἐπιχλευάζοντες, ὡς
 αὐτοὶ μὲν ἀκαθαίρετον ἕξοντες κλῆρον εὐτυχίας, ὃν παισὶ καὶ ἐκγόνοις
κατὰ διαδοχὴν ἀπολείψειν ἤλπισαν,"
503,Section169Sent3,"αἰεὶ δὲ ἐποψόμενοι τοὺς ἀντιπάλους
ἐν βεβαίῳ καὶ ἀκλινεῖ δυστυχίᾳ ταμιευθησομένῃ καὶ ταῖς ἔπειτα γενεαῖς"
504,Section169Sent4,","
505,Section170Sent1,"ὑπὸ φρενοβλαβείας οὐ συνιέντες ὅτι καὶ τῆς πρὸ μικροῦ λαμπρότητος ἀπέλαυσαν οὐ δι’ αὑτοὺς ἀλλὰ διὰ νουθεσίαν ἑτέρων, οἷς τὰ πάτρια
 καταλύσασι φάρμακον ἀνευρέθη σωτήριον, λύπη, τὰ τῶν δυσμενῶν"
506,Section170Sent2,ἀγαθὰ περιαλγήσασι·
507,Section170Sent3,"κλαύσαντες οὖν καὶ στενάξαντες τὴν ἰδίαν τροπὴν
ἐπὶ τὴν ἀρχαίαν καὶ προγονικὴν ἀνακάμψουσιν εὐτυχίαν διαυλοδρομήσαντες,
 οἷς μὴ εἰς ἅπαν ἐξοκεῖλαι συνέβη."
508,Section171Sent1,"οἱ δὲ γελάσαντες τὰς ὀλοφύρσεις
ἐκείνων καὶ δημοτελεῖς ἑορτὰς ἄγειν ψηφισάμενοι τὰς ἀποφράδας
αὐτῶν καὶ τὰ πένθη κατευωχηθέντες καὶ συνόλως   τὴν ἑτέρων κακοδαιμονίαν
εὐδαιμονήσαντες, ὅταν ἄρξωνται κομίζεσθαι τὰ ἐπίχειρα τῆς 
ὠμότητος, αἰσθήσονται"
